heading,content,pg_number,tokens
Convection ovens rely on good circulation of air. For best results ensure food/containers are placed in the,"Convection ovens rely on good circulation of air. For best results ensure food/containers are placed in the centre of the Wire Rack Shelf and avoid container touching the back wall or covering venting holes.To allow good circulation of hot air, the maximum sized dish used should be no greater than Width:     12ins (30cms)Depth:     4ins (10cms)Diameter: 11ins (28cms)Positioning food For best results, always place food into a preheated oven. (See page 34.)Preheating Take care when removing dishes from the oven after cooking as Wire Rack and surfaces will be hot.Hot surfaces All foods should be placed on the Lower Shelf PositionUsing the Grill Convection Function The fan forces hot air over the food thus heating food very efficiently. To avoid over-cooking and drying of thesurface it is recommended that normal cooking temperatures are reduced by 10-20°C. Cooking times by Grill Convection are also usually shorter compared to conventional ovens.Reducing cooking temperature Do not attempt to use the Wire Rack Shelf to cook on Two levels.Two level cookingGrill Convection is particularly suitable for roasting meat, poultry and vegetables.Suitable FoodsType of Container to use DO USE: Any container suitable for conventional ovens eg metal, ceramic, earthenware, enamelled cast iron etc. DO NOT USE: Plastic containers, food films, wood/wicker, glass, paper. 56",58,296
Using the Grill Convection Function,Using the Grill Convection Function FOOD QUANTITY WEIGHTDISH COOKING TIME Chicken Chicken leg portions Duck Pork Beef Lamb Mixed Mediterranean vegetables2.5kg 51/4 lb 900g 2lb 2.7kg 6lb 2.2kg 5lb 1.6kg  31/2lb 2 x 1.4kg 3lb 450g 1lbCeramic Tray Ceramic Tray Roasting tin Ceramic Tray Ceramic Tray Roasting tin Oven-proof dish15 mins per 450g / 1lb + 15 mins 25 mins 15 mins per 450g / 1lb + 20 mins30mins per 450g / 1lb + 30 minsRare 20 minsMedium 25 minsWell-done 30 mins per 450g / 1lb20 mins per450g / 1lb + 20 mins 25 mins GRILL*  CONVECTION TEMPERATURE Grill + 180°C Grill + 190°C Grill + 190°C Grill + 180°C Grill + 190°C Grill + 180°C Grill + 220°CBelow are suggested cooking times for popular foods however the time required will depend on shape/size of dishes as well as method of preparation.Suggested Cooking timesGrill Convection *Grill level will be set automatically when a Convection temperature is selected.  Note: All timings based on a preheat temperature of 220°C.,59,299
Using the Grill Function,"Using the Grill Function Take great care when turning food - Wire Rack Shelf and oven walls will be extremely hot. Take care as there is NO NON-TIP LOCK mechanism on Wire Rack Shelf. Caution: Turning food The grill will only operate when the door is closed.Door closed It is essential that the walls and particularly the roof of the oven are kept free of grease to avoid excessivesmoking when the grill function is operated.Smoke For best results, always place food into a preheated oven. See page 34.Preheating All foods should be placed on the Upper Shelf Position Most foods benefit from turning halfway during cooking.Turning Don’t forget to drain juices from foods halfway during cooking to prevent excessive smoke and splatter.DrainingGrill is particularly suitable for steaks, burgers, fish & bacon.Suitable FoodsType of container to use DO USE: Any container suitable for fierce grilling eg stainless steel, Le Creuset, Ceramics, Baking Sheets etc.DO NOT USE: Plastic containers, fine ceramics, cling film etc. Take care when removing dishes from the oven after cooking as the Wire Rack and surfaces will be hot.Hot Surfaces",60,234
COOKING TIME,"COOKING TIME 12 mins 12 mins 8 mins 10 mins 10 mins 6 mins 6 mins 10 mins 6 mins 6 minsGRILL SETTINGBelow are suggested cooking times for popular grilled foods. The time required will depend on the start temperature, depth and shape of food. Most foods benefit from turning halfway during cooking.Suggested Cooking times FOOD QUANTITY WEIGHT FISH Whole Trout Salmon Steaks MEAT Burgers-fresh Gammon steaks Rump steak-medium Sirloin steak-medium Bacon MISC Tomatoes Mushrooms Brulee- finishing2 / 400g each 6 / 175g each 4 / 100g 4oz 2 / 250g 8oz 1.4kg 3lb 900g 2lb 12 rashers 450g 1lb 450g 1lb 8 ramekinsLow Low High High High High High High High HighGrillUsing the Grill Function Note: All timings based on preheat temperature of 220°C.",61,214
Using the Fan Grill Function,"Using the Fan Grill Function The Fan Grill will only operate when the door is closed.Door closed It is essential that the walls and particularly the roof of the oven are kept free of grease to avoid excessive smoking when the Fan Grill function is operated.Smoke For best results, always place food into a preheated oven. (See page 34.)Preheating Don’t forget to drain juices from foods halfway during cooking to prevent excessive smoke and splatter.DrainingFan Grill is particularly suitable for cooking pizzas, chops & sausages.Suitable Foods Below are suggested cooking times for popular foods. The time required will depend on the start temperature,depth and shape of food.Suggested Cooking times FOOD QUANTITY WEIGHT COOKING TIME Oven chips - frozen Pizza - frozen Garlic bread slices - frozen Lamp chops Pork chops Sausages - chilled900g/2lb 400g/20cm 6/160g 8/760g 4/760g8/450g15mins 10mins 5mins 15mins 20mins14minsFAN GRILL  TEMP 220°C 210°C 220°C 220°C 220°C 230°CType of container to use DO USE: Any container suitable for fierce grilling eg stainless steel, Le Creuset, Ceramics, Baking Sheets etc. DO NOT USE: Plastic containers, fine ceramics, cling film etc. Some foods, eg sausages will require turning halfway through cooking.TurningTake care when removing dishes from the oven after cooking as the Wire Rack and surfaces will be hot.Hot Surfaces All foods should be placed on the lower shelf position.Shelf position Note : All timings based on a preheat temperature of 220°C",62,348
Using the Combination Function,"Using the Combination Function Avoid using large or deep sided metal containers. This will restrict the effectiveness of Microwaves and lengthen the heating time. Use heat-proof ceramic containers for best results on Combination.Metal Containers For best results, place food in a preheated oven.(See page 34.)Preheating NOTES: 1. If arcing occurs ! Stop oven immediately and continue to cook by Convection / Grill Convection / Fan Grill only and transferfood to a suitable container. 2. Check the food is cooked thoroughly at the end of the standing time.The Wire Rack Shelf may be placed in either shelf position depending on the type of COMBINATION progamme in use. ie UPPER position for a GRILL COMBINATION or FAN GRILL COMBINATION and LOWERposition for CONVECTION/GRILL CONVECTION COMBINATION. The Ceramic Insulating Tray must be usedwhen food is placed in a metal container. NEVER place a metal container onto the Wire Rack Shelf if cookingby Combination as arcing may occur and damage the dish/oven.Accessories to use When cooking meat joints and other fatty items, drain fat to avoid excessive splatter and smoke.Draining Fat DO NOT attempt to use the Wire Rack Shelf to cook on two levels.Two level Cooking As a COMBINATION setting uses Microwave energy to cook the food, it is important to allow a standing timefor the food to finish cooking. (See page 38.)  As a rough guide recipes cooking fish, vegetables, and small parts will require 5-10 minutes standing time andjoints and whole poultry will require 15-20 minutes standing time.Standing TimeFan GrillCombination programmes use microwaves and heat (CONVECTION or GRILL CONVECTION or GRILL or FAN GRILL) therefore you must choose the container carefully.DO USE: Metal containers check they do not have jagged metal seams. Ceramics that do not have a metal pattern. Heat proof glass and china. DO NOT USE:  Enamelled items (that may be chipped). Dishes with gold/metal pattern.Enamelled cast iron eg. Le Creuset. Any dish that’s not heatproof eg plastics, and cling film.Type of container to useCombination Guidelines for using the 5 Preset Combination Settings PRESS DISPLAY SUITABLE FOODS Once Twice 3 Times 4 Times 5 Times1 2 3 4 5Reheating chilled pastry, chilled entrees, baking pies & en croute dishes,  jacket patatoes. Reheating frozen pastry, oven chips & snacks. Cooking fish. Reheating frozen pizzas, breads & patisserie. Cooking steaks & chops. Cooking frozen en croute dishes, roasting vegetables, cooking sausages. Cooking bacon, burgers, frozen fish, & reheating pre-cooked meats.",63,584
.Containers,".Containers If you are preparing recipes for freezing toregenerate on Combination, choose containersthat are microwave safe as well as heat-proof andsuitable for freezing.To make good use of the microwave energy thecontainers should not be too deep. When preparing multi-portion recipes, select acontainer that is not too large for cavity of the ovenas this may restrict circulation of the hot air. 2. Reheating two dishes together Ensure that you serve your recipes in identicaldishes if reheating more than one dish at a time,so they reheat at the same speed.NEVER use the Wire Rack Shelf for reheating ontwo levels.3.Memory Programmes Consistency in preparation and careful choice ofserving dish will mean you can use the MemoryProgrammes to reheat a regularly requested item.Some experimentation may be needed at first toselect the correct setting however as long as youdo not vary from the standard set, you can beconfident of the Memory Programme chosen.Don’t forget to probe dishes to check that they are72°C in the centre, or thickest part, before serving. 4.Increasing Quantities When increasing quantities, choose an adequatelylarger container. If reheating on GRILLCOMBINATION, a larger quantity may need to bereheated using a Multi-stage (sequential)programme ie MICROWAVE only then GRILLCOMBINATION as the food does not overbrownbefore it is throughly heated through. Tips for Reheating your own Homemade FoodsReheating by Combination",64,306
NOTES:,"NOTES: DO NOT attempt to reheat any food that is suitable only for DEEP FAT FRYING.DO NOT ATTEMPT TO FRY IN OVEN. Always reheat foods in a preheated oven.Reheating by Combination Tips for Reheating Commercially Prepared Foods Many Commercially prepared foods are ideal for reheating on COMBINATION - offering the advantage of large time saving as only a fraction of the conventional heating time is required. It also means that many foods willhave a “freshly cooked” appearance due to the crisping and browning  that takes place -more appetising formany recipes than MICROWAVE only. 1.Using Supplier’s Instructions Check the pack instructions carefully as these willbe a good indication of how to choose yourcombination programme.  2.Choosing the Programme Refer to the following charts and find a similarfood to select an appropriate programme. Manycommercially frozen foods are partially cooked eg quiche, may have a part-cooked pastry basewith an uncooked filling, or an en croute may befully cooked in the centre even if the pastry is raw.CHECK CAREFULLY whether the food is alreadycooked and requires reheating only or whether itcontains uncooked components and must bethroughly cooked before serving. Generally, a food that requires cooking will be moresuccessful on a lower Temperature/Microwavepower and longer heating time. Foods that require reheating only are heated for ashorter time and may benefit from highertemperatures. 3.Checking Temperature Always ensure that the food has reached atemperature of at least 72°C if it is beingreheated.If the food requires cooking, then checkit has reached the appropriate temperature. 4.Variations in weight If the foods to be reheated vary in weight fromthose shown in the charts over, reduce/increasethe times appropriately. If the products are reheated by a Multi-stage(sequential) programme, reduce/increase theMICROWAVE only times first but leave thebrowning GRILL times the same. If cooking/reheating products from frozen by aMulti-stage(sequential) programme double themicrowave time given for reheating from “fridge”temperature and add a further 50-75% extra to thebrowning GRILL time.If cooking/reheating products from frozen by astraight COMBINATION CONVECTION setting,add approximately 50% extra time to the timerequired from “fridge” temperature.5.Containers If a particuiarly solid food or dish that cannot bestirred eg Lasagne, is contained in foil, transfer to asuitable non-metallic dish whilst frozen. 6.Pre-browned foods Many commercially prepared cooked foods eg.sausages may be pre-browned. These are oftenbetter reheated by MICROWAVE only rather thanCOMBINATION. Foods that are pre-browned, butrequire further crisping, should be reheated onCOMBINATION CONVECTION /GRILL CONVECTION / FAN GRILL. 7.Arranging It is essential that individual items are arrangedevenly for thorough reheating by MICROWAVE andbrowning by GRILL/CONVECTION/FAN GRILL/GRILL CONVECTION.Combination",65,663
Cooking Fish on Combination,"Cooking Fish on Combination 1.Arranging When cooking fillets or whole fish, always arrangethe thicker part to the outside of the container. Twofish cooked together should be placed head to tail,with the backbone towards the outside to the dish.Fish steaks should be arranged with the thinnertall end towards the centre. DO NOT PILE fish up -for best results cook in a single layer. 2.Adding fat / oil / seasoning To help keep the fish moist, brush with oil or dotwith butter before cooking. DO NOT season withsalt. 3.Covering DO NOT COVER fish when cooking byCOMBINATION. 4.Shelf position For GRILL COMBINATION which is suitable forsmall whole fish, steaks, fillets, use UPPER shelfposition. For CONVECTION COMBINATIONwhich is suitable for larger whole fish, use LOWERshelf position. 5.Accessories / Containers DO NOT use metal containers for cooking byCOMBINATION - microwave-safe glass orceramics are ideal. If the fish is placed on theCeramic Insulating Tray, ensure it is thoroughlycleaned beforehand. 1.Turning / Basting / Draining For best results, joints of meat should be turnedhalfway through cooking and basted. Drain awayany excess meat juices and fat. 2.Shielding Unevenly shaped joints will benefit from shieldingwith smooth pieces of aluminium foil. However,ensure the foil is not in contact with Wire RackShelf, walls, roof or door of the oven. Shield thinends of legs of lamb and corners of rolled joints. 3.Covering DO NOT cover meat joints when cooking byCombination. 4.Accessories / Containers If the joints are placed on the Ceramic InsulatingTray, ensure it is thoroughly cleaned before use. 5.Shelf position Use the LOWER shelf position.Tips for cooking joints of meat on Combination 6.Calculating the Cooking Time As a rough guide, cook the joints for 1/2to 2/3of the total conventional cooking time.When cooking by combination, drop theconvection temperature by 10°C compared to thenormal convection temperature.Always under-estimate the cooking time and returnthe joint for further cooking if necessary. Checkinternal temperature before STANDING.  7.Standing Allow joints to STAND for 20 minutes beforecarving. 8.Maximum Weight DO NOT attempt to cook joints over 6lb (2.7kg) inweight. Avoid excessively fatty joints. 9.Maximum Microwave Power For best results ONLY use SIMMER or DEFROSTpower to avoid over-cooking and drying out thejoints.Cooking Meat on Combination",66,549
.Turning / Basting / Draining,".Turning / Basting / Draining For best results, whole chickens should be turnedhalfway through cooking and basted. Drain anyexcess meat juices and fat. 2.Shielding To prevent over-cooking, shield the breast, wingsand legs of chicken, duck and turkey with smoothpieces of aluminium foil.Ensure foil does not touch Wire Rack Shelf, walls,roof or door of oven. 3.Covering DO NOT cover poultry when cooking byCombination.  4.Stuffing DO NOT stuff the complete cavity of poultry ifcooking by Combination. Neck end of bird onlymay be stuffed. Cook stuffing separately onMicrowave SIMMER power.Tips for cooking Poultry on Combination 5.Calculating the Cooking Time As a rough guide, cook poultry 2/3of the usual total conventional cooking time. For poultry, best resultsare obtained by using the same temperature as forconventional cooking. Check the internaltemperature before STANDING. 6.Standing Allow poultry to STAND for 15-20 minutes beforecarving. 7.Maximum Weight DO NOT attempt to cook joints over 6lb (2.7kg) inweight. Avoid excessively fatty joints.Cooking Meat on Combination 1.Turning Most thicker, cuts benefit from turning duringcooking. When turning, remove Wire Rack Shelfcompletely. If cooking small items directly onCeramic Insulating Tray, remove tray to turn food -DO NOT leave shelf extended from oven as thereis NO NON-TIP SAFETY LOCK. 2.Arranging Arrange small cuts evenly and for best results usefull width of oven. DO NOT pile foods on top ofeach other, arrange in a single layer only. 3.Draining Juices For best results, place food directly on Wire RackShelf using Ceramic Insulating Tray on base ofoven to catch drips. This tray must be removed forcleaning to avoid excessive smoke/splatter and tocook efficiently.Small items can be placed directly on Ceramic Insulating Tray on top of Wire Rack Shelf.  4.Standing Time Small cuts require 5-10 minutes STANDING timebefore serving.Tips for cooking Small Cuts on Combination 5.Calculating the Cooking Time Cooking small cuts on Combination grill allowsmost cuts to brown and crisp more quickly thanwhen conventionally grilled. Allow roughly  2/3the conventional time as a guide. 6.Container DO NOT place food on a metal tray/container asthis will slow down cooking time by reducing effectof Microwave Power. 7.Cleaning the Oven It is essential that the oven is kept very clean forCombination Grill, to avoid excess smoke andsplatter. Combination",67,544
Suggested Reheating / Cooking Times,Suggested Reheating / Cooking Times FOOD WEIGHT QTY APPROX. TIME Breaded onion  rings Onion Baji Vegetable Samosa Spring Rolls Oven Chips Hash Browns Roast Potatoes  Breaded MushroomsGratin Dauphinoise225g 8oz  210g / 71/2oz  35g  each 200g / 7oz 50g each 175g / 6oz 30g each 250g 9oz 225g / 8oz 30g each 350g 12oz  225g 8oz  225g 8oz6 4 6 841/2mins 4 mins 45secs 5 mins 3mins 45secs 5 - 6 mins 8 mins 8 mins 41/2mins 21/2mins 3 mins 1 min 30secs 21/2 minsSETTING Combi 5 Combi 2 Combi 2 Combi 2 Combi 2 Combi 2 Combi 2 Combi 5 1. HIGH power 2. Combi 4 1. HIGH power2. Combi 5Vegetables - Reheating START TEMP -18°C -18°C -18°C -18°C -18°C -18°C -18°C -18°C -18°C 2°CSHELF LEVEL Upper Upper Upper Upper Upper Upper Upper Upper Lower NOTES: All timings are based on Preheat temperature of 220°C.FOOD WEIGHT QTY APPROX. TIME Roast Potatoes Roast Mixed  Root Vegetables Roast Mixed Mediterranean VegetablesGratin Dauphinoise Jacket potatoes450g 1lb  450g 1lb  450g 1lb  800g 1lb 12oz 250-275g 9-10oz2 4 611/2mins 71/2mins 11/2mins 71/2mins 7 mins 12 mins 5 mins 2 mins5 mins5 mins 2 mins5 mins8 mins2 minsSETTING 1. HIGH power  2. Combi 4 1. HIGH power  2. Combi 4Combi 4 Combi 4 1. Combi 1 2. HIGH power 1. Combi 12. HIGH power  3. Combi 51. Combi 12. HIGH power 3. Combi 5Vegetables - Cooking START TEMP Ambient Ambient Ambient Ambient AmbientSHELF LEVEL Lower Lower Lower Lower LowerNOTES: All timings are based on Preheat temperature of 220°C.,70,551
Suggested Cooking Times,Suggested Cooking Times FOOD WEIGHT QTY APPROX. TIME Rack of Lamb Lamb Loin chops Lamb Cutlets Leg of Lamb Pork Loin Chops Gammon Steaks Sausage Cumberland Sausage Coils Bacon Rashers Leg of Pork Sirloin Steaks Beef Burgers Beef Topside Joint Whole Duck Whole Turkey Whole Chicken Chicken Leg PortionsChicken Breast Portions275g 10oz  700g 1lb 9oz  700g 1lb 9oz  2.7kg / 6lb  max 450g 1lb  450g 1lb  450g 1lb  450g 1lb  250g 9oz  2.7kg / 6lb  max  450g 1lb  450g 1lb  450g 1lb  2.7kg / 6lb  max 2.7kg / 6lb  max 2.7kg / 6lb  max 2.7kg / 6lb  max 730g  1lb 10oz 520g 1lb 3oz 1 26 6 1 2 2 8 3 9 1 3 4 4 1 1 1 1 4 461/2mins 9 mins 10 mins 111/2mins 9 mins per 450g / 1lb 8 mins 71/2mins 5 mins 2mins 51/2 mins 2mins 4 mins 13 mins Per 450g / 1lb 6-61/2mins 8 mins  10 mins 11 mins Rare 12 mins Medium 14 mins Well per 450g / 1lb 6 mins per 450g / 1lb 10 mins per 450g / 1lb 8 mins per 450g / 1lb 11 mins 8 mins SETTING Combi 4 Combi 4 Combi 3  Combi 3 Grill Convection 190°C + DEFROSTCombi 2 Combi 3  1. Combi 4  2. Fan Grill 250 °C1. Combi 4 2. Fan Grill 250°CCombi 5 Grill Convection 200°C + SIMMERCombi 3 Combi 5  Combi 2 Grill Convection 190°C + DEFROST Grill Convection 190°C  + SIMMERGrill Convection 180°C  + DEFROSTGrill Convection 190°C + LOW Combi 4 Combi 4Meat and Poultry - Cooking START TEMP -18°C 2°C 2°C 2°C 2°C 2°C 2°C 2°C 2°C 2°C 2°C 2°C -18°C 2°C 2°C 2°C 2°C 2°C 2°CSHELF LEVEL Lower Upper Upper Lower Upper Upper Lower Lower Upper Lower Upper Upper Upper Lower Lower Lower Lower Lower Lower NOTES: All timings are based on Preheat temperature of 220°C.Combination,73,663
Common Problems,"Common Problems PROBLEM SOLUTION Food cools quickly after Microwave or Combination cooking. Foods take longer to cook, defrost or reheat than stated. Liquids boil over when cooked by  microwave or combination.Vegetables become wrinkly and hard when cooked/reheated by  microwave.Foods heat unevenly. Only one side of cavity heats. Foods heated by microwave are  hard and tough.Foods “explode” during heating. Foods that have been defrosteddo not heat in the centre.Return to oven for additional cooking. Check oven is plugged into its own 13amp socket. Do not use extension  cable or adapters.The stated times are only a guide.Heating will be improved with the use ofcorrect containers and arranging. Remember to vary the heating, if the  food is colder or heavier than stated.Ensure the oven is cleaned regularly. Use a container twice the volume of the  liquid.Allow standing time when cooking andslightly undercook vegetables, if they  are to be reheated.Arrange foods, so that thicker parts are on the outside of the plate and smaller foods to the centre. Do not heat very dense foods with porous foods as the later will heat faster. Rearrange foods as above. It is impossible for only one side of the cavity to receive microwaves as the energy is distributed by a rotating guide.if the magnetron is no longer working  all food will remain cold.Reduce the time or power with more  delicate foods. Reduce power level.Pierce skins on foods to release pressure build up during heating.  NEVER try to boil eggs in shells.Check that foods are between 1-4°C before going on to reheat. If the edges of the food are getting too warm shield with foil. (See page 49.) CAUSE Food insufficiently heated. Oven not receiving enough power. Food type, size, weight,temperature not exactly as stated. Oven dirty and food debris is absorbing the microwave  energy.Containers too small. Vegetables over-cooked. Foods incorrectly arranged or incompatible foods are being heated together. Foods incorrectly arranged. Foods overcooked. Power level too high.Skins of foods i.e potatoes, chicken are not pierced. Foods have not been sufficiently defrosted orallowed to stand beforereheating.This section tries to solve any common problems you may have. Remember to always keep your Operating Guide on hand for reference.",76,483
Common Queries,"Common Queries Question Answer Can I use the oven Off-Shore ? Where can I obtain additional oven accessories ?Can the oven be stacked? Can I dry tea towels and clothes in  the oven ? How often should the oven be serviced ?Yes if the supply is 50Hz. The oven will not Operate at 60Hz.Contact the manufacturer or the dealer from whom you purchased  the oven.Do not stack your Panasonic Combi Oven on other microwaves of similar or different models. It is best to site your oven clear of all other kitchen equipment which may produce excess humidity i.e.  oven ranges, deep-fat fryers etc.No. Never put these, or similar items in your Panasonic Combi Oven. It is best to be guided by your authorised Service Agent. This depends on usage however keep oven clean.Common Problems PROBLEM SOLUTION Dishes get hot. Condensation appears in the  cavity and door. Steam is expelled from around the door. Smoke appears around the door when grilling. The ceramic cavity base cracks.This is normal, particularly in covered  dishes. Remove lids/film carefully to  prevent steam burns. Carry out the dish test given withGlossary of Terms. Do not use  unsuitable dishes.This is normal and an excellent way of heating the plate !  This is normal and the condensation should be wiped off a soft cloth.  Ensure air vents are not blocked.This is normal. The intricate workings of the door safety devices will prevent the escape of microwave energy but  not steam or cooking smells.Stop the oven and drain away all excessfat and juices. Watch the food carefully as it grills. Ensure the cavity ceiling is cleaned regularly.Be careful to place the food carefully onthe base of the cavity. Do not slam ordrop the food: the base is made fromceramic not painted metal.CAUSE Steam trapped within  container transferring heat to dish.The dish is absorbing the microwave energy. If the “Preheat” function is inoperation, the dish will absorbsome of the residual heat in  the  cavity. Food is heating faster than the steam can be expelled. The steam is finding an exit from cavity. Fat from foods is splashing onto the grill elements and burning. Operator mis-use.Common Queries",77,451
