heading,content,pg_number,tokens
Open Door.,"Open Door. Put in Food. Close Door.The oven lamp will come on. Oven lamp turns off. 2Select Power Level.Press Microwave Pad to select correct power.eg. HIGH––see below. 3Select Time. Press Number Pads to set a heating time.eg. 4 mins. 30 secs. Press Pads 4, 3 and 0. Max time you can set: HIGH, MEDIUM 15 minsOther 60 mins 4Press  Start Pad.Display window will count down time.The cooling fan will be turnedon. At end of heating programme, oven beeps 3 times, and “0” flashes inwindow until door is opened. Remove food. Display window will indicatethe previous programme.5Open Door. End of Programme Open DoorCONTROLS TO USE INFORMATION ACTION DISPLAY ACCESSORIES TO USE Do not use the Wire Rack Shelf or Ceramic Insulating Tray whencooking by microwave.Once Twice 3 Times 4 Times 5 Times 6 Times1150 850 560 420 180 0PRESS WATTSOperating your Oven as a Microwave HIGH MEDIUM LOW SIMMER DEFROST STANDPOWER LEVEL",18,240
Hot Surfaces,"Hot Surfaces Take great care when removing hot food. Use oven gloves. Multi-Stage (Sequential) Heating The oven can be programmed with up to 3 differentstages to operate in sequence. These can beMICROWAVE, GRILL, CONVECTION, FAN GRILL , GRILL CONVECTION or COMBINATION functions. If a required heating time is greater than 15 minutes onHIGH or MEDIUM power, use 2 stage programming.For 2 stage programming:Follow steps 1-3 then enter the next heatingprogramme, and press START Pad.For 3 stage programming:Follow 2 stage programming and enter a 3rd heatingprogramme before pressing START Pad. Oven Lamp The Oven Lamp switches off when the door is closed. Ifyou want to check the food, press Lamp Pad, it willthen illuminate for 10 seconds.The Oven Lamp turns on whenever the door is opened. Repeat Feature You can repeat the same heating programme if youpress START Pad within 1 minute of the previousprogramme finishing.After 1 minute, if START Pad is not pressed the displaygoes blank if the oven door is closed.After 30 minutes returns to “0” if the oven door is open. Stop/Reset Pad Before heating: One press clears the display.During heating: One press stops the heating cycle  and two presses clear the display. N.B. see page 32 for operation whilst in ProgrammeLock.MicrowaveOperating your Oven as a Microwave",19,300
Operating your Oven on Convection,"Operating your Oven on Convection CONTROLS TO USE INFORMATION ACTION DISPLAY 1Open Door. Put in Food. Close Door.The oven lamp will come on. Oven lamp turns off. 2Press ConvectionPad.*Select required oven temperature. eg. 180°C Continue to press ConvectionPad until temperaturerequired appears in displaywindow.Temperature counts up in10°C from 100°C-250°C. 3Select Time. Press Number Pads to set a heating time.eg.18 mins. Press Pads 1,8,0 and 0.Max heating time is: 99 mins. 99 secs. . 4Press  Start Pad.Display window will count down time.The Convection fan turns on. At end of heating programme,oven beeps 3 times, and “0” flashes inwindow until door is opened. Remove food. Display window will indicatethe previous programme.5Open Door. End of Programme Open Door ACCESSORIES TO USE For best results place the cooking container on Wire Rack Shelf in LOWER position. Food can be placed directly on the Wire Rack Shelf if itis thoroughly cleaned before use. Caution:There is NO NON-TIP Safety Lock on Wire Rack Shelf. Take care when removing food.* The oven will memorise the last  CONVECTION temperature usedshould you wish to use the sameone again. Press the CONVECTION pad when cooking is complete & thelast temperature used will be displayed.",20,295
Operating your Oven on Grill Convection,"Operating your Oven on Grill Convection CONTROLS TO USE INFORMATION ACTION DISPLAY 1Open Door. Put in Food. Close Door.The oven lamp will come on. Oven lamp turns off. 3Press ConvectionPad.*Select required oven temperature. eg. 180°CContinue to press ConvectionPad until temperaturerequired appears in displaywindow.Temperature counts up in10°C from 100°C-250°C 4Select Time. Press Number Pads to set a heating time. eg. 18 mins. Press Pads 1,8,0 and 0. Max heating time is: 99 min. 99 secs. 5Press  Start Pad.Display window will count down time.The Convection fan turns on. At end of heating programme,oven beeps 3 times, and “0” flashes inwindow until door is opened. Remove food. Display window will indicatethe previous programme.6Open Door. End of Programme Open Door2Press Grill Pad.High or Low level can be selected but Grill level isautomatically fixed afterpressing Convection pad. ACCESSORIES TO USE For best results place the cooking container on Wire Rack Shelf in the LOWER position. Food can be placed directly on the Wire Rack Shelf if it is thoroughly cleaned before use. Caution:There is NO NON-TIP Safety Lock on Wire Rack Shelf. Take care when removing food.* The oven will memorise the last  CONVECTION temperature usedshould you wish to use the sameone again. Press the CONVECTION pad when cooking is complete & thelast temperature used will be displayed.",22,322
Operating your Oven on Grill,"Operating your Oven on Grill CONTROLS TO USE INFORMATION ACTION DISPLAY 1Open Door. Put in Food. Close Door.The oven lamp will come on. Oven lamp turns off. 2Press Grill Pad.Select required Grill level. eg. High Display Output 1 press Hi 1800 W2 presses Lo 1450 W 3Select Time. Press Number Pads to set a heating time. eg.10 mins. Press Pads 1,0,0 and 0.Max heating time is: 60 mins. 4Press  Start Pad.Display window will count down time.The convection fan turns on. At end of heating programme,oven beeps 3 times, and “0”flashes in window until door isopened. Remove food. Display window will indicatethe previous programme.5Open Door. ACCESSORIES TO USE For best results place the food on Wire Rack Shelf in UPPER position. Ceramic Insulating Tray may be placed on base of oven to catchsplashes and drips. Small items of food that might fall between Wire RackShelf can be cooked directly on ceramic Insulating Tray on Wire RackShelf in UPPER position. Drain frequently to avoid excessive spitting.Deep dishes may be finished under the grill placed on the Wire RackShelf in the LOWER position or placed directly on ceramic base. Caution:There is NO NON-TIP Safety Lock on Wire Rack Shelf.Take care when removing food.End of Programme Open Door",24,292
Operating your Oven on Fan Grill,"Operating your Oven on Fan Grill CONTROLS TO USE INFORMATION ACTION DISPLAY 1Open Door. Put in Food. Close Door.The oven lamp will come on. Oven lamp turns off. 2  Press Fan GrillPad.*Select required Fan Grill temperature. eg. 180°C Continue to press Fan GrillPad until temperaturerequired appears in displaywindow.Temperature counts up in10°C from 100°C-250°C 3Select Time. Press Number Pads to set a heating time.  eg.20 mins.  Press Pads 2,0,0 and 0.Max heating time is: 99 mins. 99 secs. 4Press  Start Pad.Display window will count down time.The convection fan turns on. At end of heating programme,oven beeps 3 times, and “0”flashes in window until door isopened. Remove food. Display window will indicatethe previous programme.5Open Door. ACCESSORIES TO USE Caution: There is NO NON-TIP Safety Lock on Wire Rack Shelf.Take care when removing food.End of Programme Open Door* The oven will memorise the last  FAN GRILL temperature used should you wish to use the sameone again. Press the FAN GRILL pad when cooking is complete & thelast temperature used will be displayed. For best results place the cooking container on Wire Rack Shelf in the LOWER position. Food can be placed directly on the Wire Rack Shelf if it is thoroughly cleaned before use.",26,300
* Combi 1 may only be used as,"* Combi 1 may only be used as the first stage of a 2 or 3 stage cooking programme.Operating your Oven on Combination 2Press CombinationPad.CONTROLS TO USE INFORMATION ACTION DISPLAY 1Open Door. Put in Food. Close Door.The oven lamp will come on. Oven lamp turns off. 4Press Start Pad.Display window will count down time. At end of heating programme, oven beeps 3 times, and “0” flashes inwindow until door is opened. Remove food. Display window will indicatethe previous programme.5Open Door.ACCESSORIES TO USEFor best results place food on Wire Rack Shelf in the LOWER position. The Ceramic Insulating Tray MUST be used if the cooking container ismetal, NEVER place a metal container directly onto the WIRE SHELFwhen cooking by COMBINATION as arcing may occur and damage thedish/oven. (See page 61.) End of Programme Open DoorSelect Preset Combination Number. (1-5)eg. 1––see below. Once Twice 3 Times 4 Times 5 Times5 mins 60 mins 60 mins 60 mins60 minsPRESS MAXIMUM HEATING TIMEMICROWAVE  POWERDISPLAY 1* 2 3 4 5HIGH SIMMER DEFROST LOWLOWPreset Combination 3Select Time. Press Number Pads to set a heating time. eg.3 mins. Press pads 3,0 and 0.Max heating time is: 5 min.Caution: There is NO NON-TIP Safety Lock on Wire Rack Shelf. Take care when removing food. Fan Grill Fan Grill Fan Grill Grill Convection GrillGRILL OR  CONVECTION SETTING 250°C 250°C 250°C 250°C HiGRILL LEVEL OR CONVECTION TEMPERATURE ",28,370
Operating your Oven on Combination,"Operating your Oven on Combination 2Select Power Level. **CONTROLS TO USE INFORMATION ACTION DISPLAY 1Open Door. Put in Food. Close Door.The oven lamp will come on. Oven lamp turns off. Press Microwave Pad to  select correct power.eg. LOW.Manual Combination 3Press Grill Pad  or Fan Grill Pad*** or  ConvectionPad *** or Grill Pad * + Convection Pad *  ***MWO + GRILL Select Grill Level. Display Output 1 press Hi 1800 W2 presses Lo 1450 Weg. Hi. OR MWO + FAN GRILL Press Fan Grill Pad untilrequired temperature appears in display.eg. 200°C. OR MWO + CONVECTION Press Convection Pad untilrequired temperature appears in display.eg. 200°C. OR MWO +  GRILL CONVECTIONHi or Lo level can be selectedbut Grill level is automaticallyfixed after pressing Convection Pad. + Press Convection Pad until required temperature appearsin display.eg. 200°C. 4Select Time. Press Number Pads to set a heating time. eg. MWO + GRILL 18 mins.Press pads 1,8,0 and 0Max heating time is: 60 mins.* Combination of Microwave and Grill and Convection is possible. ** Combination settings using  HIGH or MEDIUM power mayonly be used as first stage of a 2 or 3 stage cookingprogramme and for a maximum5 minutes heating time. *** The oven will memorise the  last CONVECTION, GRILL CONVECTION, or FAN GRILL temperature used on COMBINATIONshould you wish to use the same one again. Press the CONVECTION orFAN GRILL pad when cookingis complete & the last temperature used will be displayed.Combination + (ACTIONS 5 - 6 continued on next page.)",29,384
CombinationOperating your Oven on Combination,"CombinationOperating your Oven on Combination Recalling Preset Combination Number (Only Preset Combination) The Preset Combination Number (1 - 5) selected can be checked during operation by pressing CombinationPad.The Preset Combination Number will be displayed for 3seconds before returning to remaining heating time. Recalling Grill level (Only Manual Combination and Grill Combination) The Grill level selected can be checked duringoperation by pressing Grill Pad. The Grill level will bedisplayed for 3 seconds before returning to remainingheating time. Recalling Convection Temperature (Only Manual Combination) The temperature selected can be checked duringoperation by pressing Convection Pad. Temperaturewill be displayed for 3 seconds before returning toremaining heating time.The temperature cannot be altered during aprogramme. Recalling Fan Grill Temperature (Only Manual Combination) The temperature selected can be checked duringoperation by pressing the Fan Grill Pad. Thetemperature will be displayed for 3 seconds beforereturning to remaining heating time.The temperature cannot be altered during aprogramme. Oven Lamp The Oven Lamp switches off when the door is closed. Ifyou want to check the food, press Lamp Pad, it willthen illuminate for 10 seconds.The Oven Lamp turns on whenever the door is opened. Repeat Feature You can repeat the same heating programme if youtouch the START Pad within 1 minute of the previousprogramme finishing.After 1 minute, if START Pad is not pressed the displaygoes blank if the oven door is closed.After 30 minutes returns to “0” if the oven door is open. Stop/Reset Pad Before heating: One press clears the display.During heating: One press stops the heating cycle  and two presses clear the display. N.B. see page 32 for operation whilst in ProgrammeLock.",31,358
CONTROLS TO USE INFORMATION ACTION DISPLAY,"CONTROLS TO USE INFORMATION ACTION DISPLAY 1Open Door. The oven lamp will come on. 2Press Prog Pad.Keep pad pressed for  2 seconds until “P” is displayed. KEEP DOOR OPEN 3Press  ProgrammeNumber.eg. To set Programme 03: SIMMER 20 mins. Press Number Pads 0 and 3. If programme has beenpreviously set, this will appearin the display.If the programme memory isempty then the programmenumber will appear in thedisplay. 5Select Time. eg. Press Number Pads 2, 0, 0, and 0. After 3 seconds displayreturns to “0”.6Press Prog Pad.4Select Power.eg.Press Microwave Power Pad 4 times.Setting the Memory Programmes Please ensure that the SD Memory Card is inserted in the Oven. Your oven has 99 blank memory programmes for your own heating requirement.All 99 Memory Programmes can be set manually using the Prog Pad on the Control Panel.However, these programmes can be stored onto the SD Memory Card using your personal computer (see pages 79-81).Any programme information stored directly onto the SD Memory Card will override any manual programmespreviously set.",32,254
Using the Memory Programmes,"Using the Memory Programmes INFORMATION ACTION 1Open Door. Put in Food. CLOSE DOOR.The oven lamp will come on. Oven lamp turns off. 2Press Number Pads required.eg. For programme 03.  Press Number Pads 0 and 3. This example is preset Memory Programme:SIMMER power 20 mins. 3Press START. Display window will count down time.DISPLAY Programme Lock If programme lock is activated, programme starts immediately therefore there is no need to press STARTPad.Programme Lock It is NOT possible to enter a programme when Programme Lock is set.  Multi-stage (Sequential Cooking) It is possible to programme into the memory a 2 or 3stage programme using MICROWAVE, CONVECTION,GRILL, FAN GRILL, GRILL CONVECTION orCOMBINATION.  Changing a Memory Programme To change a programme simply follow steps 1-6 onprevious page entering your new programme.Setting the Memory Programmes Please ensure SD Memory Card is inserted in the oven.",33,211
INFORMATION ACTION,"INFORMATION ACTION 1Open Door. The oven lamp will come on. 2Press Prog Lock Pad.Keep key pressed for 2 seconds until “P” is displayed. KEEP DOOR OPEN.After 2 seconds.... After 3 seconds...DISPLAY Two Touch Operating Mode The oven reverts to 2 TOUCH OPERATION mode when you deactivate Programme Lock. Press requiredNumber Pads then press START Pad. Interrupted Programme If the door is opened during a programme, onceprogramme lock is deactivated, the remaining heatingtime will be retained in the display window until thedoor is closed and START Pad is pressed. Repeat Feature Once a manual heating programme has finished, theoven will automatically display the programme again fora repeat programme with the Programme Lockdeactivated. Setting New Programs Once Programme Lock is released, you can enter newheating programs. Programme List It is possible to check the programmes that have been entered into the SD Memory Card. With the door open, press START pad and Number pad 1 simultaneously. (The Oven will make an acknowledging beep). After 2seconds, the display window will show each individual stage of each Memory Programme in the order 01, 02,03 etc. Finally, it will display the Beep Tone setting , the Programme Lock symbol (P.L), the time interval forcleaning of the Air Filter, before clearing to “0”.How to Deactivate Programme Lock",35,282
Notes on Preheat and Cooling:,"Notes on Preheat and Cooling: Only PREHEAT and COOLING functions can be selected when the display is blank. All other programmes must have “0” in display. You can select PREHEAT function during a COOLING function and vice versa.After a heating function has completed, oven will revert to PREHEAT function automatically.To assist in faster heating and browning results, the PREHEAT feature is designed to keep your oven at a background temperature of 190°C, 220°C or 240°C for a hot start before using a GRILL, CONVECTION, FAN GRILL, GRILL CONVECTION or COMBINATION function. CONTROLS TO USE INFORMATION ACTION DISPLAY 1Press Preheat Pad. *Select a required Preheat temperature when display isblank or “0”.eg. 220°C1 press 190°C2 presses 220°C3 presses 240°C 2Press Start Pad.Preheat temperature will be maintained at the selectedtemperature. Preheattemperature is reached when“P” flashes. The door mustremain closed. If oven is notused, preheat automaticallyswitches off after 4 hours. 3Open Door. Close Door Press  Start Pad.Place food in oven. Select programme. eg. Convection 220°C 15 min Display window will count down time. At end of heating programme, beeps 3 times and “0” flashesin window until door isopened. 4Open Door. Display window will indicate the previous programme. If Start Pad is not pressed within 1 minute, oven revertsto PREHEAT temperaturepreviously selected.After 1 minuteKeeping your Oven Hot * The oven will memorise the last  PREHEAT temperature used should you wish to use the sameone again. Press the PREHEAT Pad and the last temperature used will be displayed.",36,374
Cooling your Oven Quickly,"Cooling your Oven Quickly To quickly cool the oven cavity, the Panasonic Combi has a Cooling Pad. The Cooling Pad can be used effectively at the end of a cooking session to cool the oven for cleaning or if it is required for defrosting orheating by MICROWAVE whilst on PREHEAT function. INFORMATION ACTION 1Press Cooling Pad. You can select cooling when the display is blank (door closed), or when “0” is in the display (dooropen). 2Press Start Pad. •The COOLING fan and CONVECTION fan will turn on. •The oven door can be opened or closed  but cools fastest when the door is open. •The oven will cool in 3-30 mins. depending on temperature.DISPLAY 3Once the oven has cooled. The cooling and convection fans switch off.(eg. Display has “0”)",37,180
How to Change the Beep Tone,"How to Change the Beep Tone INFORMATION ACTION 1Open Door. Keep Door Open.The oven lamp will come on. 2Press Prog Pad.Keep pressed Pad for 2 seconds.DISPLAY 3Press Start Pad. Press Start Pad to choose sound level required. (eg. twice for Medium) No. Presses Display Sound level 1 b-3 Loudest 2 b-2 Medium 3 b-1 Quietest 4 b-0 Silent After 3 seconds4Press Prog Pad. After 3  seconds, display returns to “0”. 36",38,119
How a Microwave Works,"How a Microwave Works 1.Reflection They will REFLECT off metal. The inner walls of your oven are made of stainlesssteel, so that the microwave energy can bounce evenly around the cavity. Of course, the microwaves will also reflect off metal cooking containers andaccessories, such as saucepans and platters. For this reason, NEVER use the WireRack Shelf on Microwave only. 2.Transmission The microwaves will TRANSMIT through paper, plastic, glass and china and,therefore, it is containers made of these substances that are used in microwavecookery. 3.Absorption The microwave energy is ABSORBED by the food. The energy penetrates theoutside area of the food causing the molecules to vibrate over 2,450,000,000 timesa second. This vibration causes the water molecules to rub against each otherproducing frictional heat which cooks this outer part of the food; the heat is thencouducted through the food to cook the centre. Food, therefore, cooks from theoutside, inwards. Standing Time The heat that builds up on the outside of the food is still being conducted to the centre, even after the microwave oven has switched off. This period is know as the “Standing Time”. The time it takes for the food tofinish cooking will vary depending on its shape, size and type. For example, a jacket potato will need to standfor at least 5-10 minutes after the end of the cooking time and during this time the temperature at the centre willincrease. A pastry pie that has been reheated will only need a standing time of 1-2 minutes for heat todistribute evenly.If the food is put back in the Microwave and heated again before the standing time has elapsed, the food canvery quickly become overcooked.To get the most from your Panasonic Combi it is helpful to understand how the oven works as a Microwave. Once connected to an outlet, the electricity flows along the flex and is converted into microwave energy by the MAGNETRON. Microwaves are ultra high frequency waves, and belong to the same category as radio andtelevision waves. These are directed into the cavity through the WAVE GUIDE.When they reach the cavity, the microwaves will behave in one of three ways: ",40,464
Reheating by Microwave,"Reheating by Microwave 1.Choosing the correct reheat time When heating foods for the first time it isnecessary to experiment, to obtain the correcttimings. Standardising portion size and ensuringrefrigeration runs without variation will enable aroutine to be developed for a particular foodproduct. Always remember that the times given byboth microwaveand food manufacturers are approximate andshould be used as a guideline. 2.Stirring Wherever possible stir food halfway through theheating time and again at the end. This ensuresthe heat spreads evenly throughout the food. 3.Is the food safely reheated ? A high level of hygiene is necessary to preventfood poisoning by such bacteria as Lysteria andSalmonella. Your Panasonic Combi will heat foodto the temperatures required and will do so muchfaster than other methods of heating. TheDepartment of Health has stated that atemperature of 70°C maintained for 2 minutes will ensure the complete destruction of Lysteria andSalmonella bacteria and the right heating time,coupled with the standing time, makes certain thefood has been heated correctly.What you can do - Ensure food has reached a temperature of at least 72°C . Check the centre and the thickest part of the food with a foodthermometer as these are the last areas to heat.When the catering operation has beenstandardised as much as possible, it will not benecessary to check every dish that passes throughthe microwave oven, but an occasional spot checkensures the food is being served to the higheststandards.4.Standing food before serving Allow food to stand at the end of the heating time.For small items, eg. sausage rolls, by the time thedish has been collected and served it will have hadsufficient standing time. Foods such as meat piesand plated meals, however, will need 1-2 minutesfor the heat to completely penetrate the centre. Donot be tempted to put the food back for additionalheating time until after the standing time has beencompleted; putting the food back too soon will onlyresult in overcooked and wasted food. Thestanding time can be used affectively to addadditional foods to the plate, or to gamishattractively before serving. Affects of the dish 1.shape A round dish heats food more evenly than asquare dish. The corners of a square dish receivedouble microwave energy and result in bubblingovercooked corners whilst the centre of the food iscold. Oval dishes give a better result but there maystill be areas of hot bubbling food at the the two“ends”. 2.Depth A shallow dish heats more quickly than a deepdish. Microwave energy only penetrates theoutside of the food. food in a shallow dish heatsevenly from all directions. In a deep dish the foodin the centre relies on conduction and takes longerto heat.3.Material Heavy earthenware and china dishes will slow theheating process by absorbing some of the heatfrom the food itself. A thinner, lighter china is abetter choice as this will not impede the cookingtime. 4.Glazed finish Always choose a glazed dish. An unglazed orchipped container can absorb water when it iswashed. As microwave energy is attracted tomoisture the water molecules contained in thechina heat up, not only causing the dish to get hotbut also slowing down the reheating time.  5.Shape of base If possible, always choose a dish that has roundedrather than sharp corners at the  base to preventover cooking.The microwave mode of your Panasonic Combi will be most frequently used to reheat food. Although the oven  is provided with a rotating wave guide, all reheating times, and uniformity of heating, will vary according toseveral factors as below.Microwave",41,767
