heading,content,pg_number,tokens
Affects of the foodsReheating by Microwave,"Affects of the foodsReheating by Microwave 9.Doubling Quantities A reheating time is based on weight and usually atime is given for a particular quantity of food, i.e.11oz Lasagne takes 2 minutes. When the numberof portions to be heated together doubles, then thereheating time will need to be increased by 75-100%. Two portions will take 4 minutes 30seconds to 5 minutes. Generally two lightertextured products such as pastries will take the shorter time, whilsttwo denser products such as Lasagne will take thelonger time. 10.Frozen Foods For speed, some foods can be reheated fromfrozen but they must be foods that can beSTIRRED eg meat sauce, Chilli con Carne. Setthe total reheat time but open the door to stirregularly.DO NOT COVER.AVOID REHEATING solid foods that cannot bestirred, eg Lasagnes/Shepherds Pies from frozen.Avoid reheating PLATED MEALS from frozen. .1.Starting Temperature The colder the food the longer it will take to heat to72°C. Extra time must be allowed if food has beendefrosted as the centre may still be icy. 2.Headspace When heating liquids, ensure they do notcompletely fill their containers; a headspace allowsthe liquids to be stirred during and at the end ofthe heating time without spillage. 3.Covering foods A container covered with either cling film, a plasticplate cover or even the lid to the dish, will heatfractionally faster then an uncovered dish. Do notcover foods which require a drier texture, such aspastries, as the steam that becomes trappedunder the cover will cause the food to go soggy. 4.Crisp Foods Reheat pastry and bread items, such as sausagerolls, pies and croissants, on a plastic rack toreduce the chance of “sogginess”. The rack allowsthe air to circulate beneath the food and removesteam which causes moist, limp pastry. YourPanasonic Combi offers a COMBINATION facilitywhich will help crisp pastry items as they reheat. 5.Uneven shapes When heating uneven shaped pieces of food,place the thick part of one piece against the thinpart of the second. This helps the food to heatmore evenly. 6.Porous Foods/Dense foods Porous foods reheat more quickly than denseheavy foods. 7.Food with “Skins” When reheating foods with a skin such as fish,chicken or baked beans, reduce the power to alower setting to prevent the food from heating tooquickly and “exploding”. 8.Heating two dishes together It is possible to reheat two products with the sameheating time together. For example, two ChickenCurries with a reheating time of 4 minutes each orone Taglatelle Carbonara and one moussaka, bothof which have a heating time of 4 minutes each.",42,624
Tips for Reheating your own Homemade Foods,"Tips for Reheating your own Homemade Foods Serving foods prepared in-house gives a homemade quality to the menu and allows for seasonality. However, for best results, follow the tips below if they are to be regenerated in your Panasonic Combi Oven. 1.Overcooking Do not overcook vegetables - slightly undercook them, and they will finish cooking during the reheating time. 2.Sauces Make any foods in sauces with lighter gravies rather than heavy, thick ones, as this helps the food heat evenly. 3.Plated Meals To ensure even heating arrange the singlecomponent foods of a plated meal carefully. Place denser foods, such as whole vegetablesand portions of meat or fish, to the outside of theplate, and smaller items, towards the centre. Do not pile foods up but keep them in a singlelayer; mashed patato should be spread out ratherthan mounded up. The food can look attactive butalways give the Microwave a chance to heatevenly and thoroughly. 4.Vegetables Dot vegetables with butter and pour gravy over themeat to prevent drying out and to help with evenheating. 5.Rice Arrange meat sauces served with rice, side byside rather than in the traditional circle of rice withthe sauce in the centre. The sauce should beflattened slightly, whilst the rice is piled up. 6.Potato Topped Pies Potato-topped pies and au gratin dishes, egCottage Pie, are difficult to reheat as theconsistency of the potato will heat faster. Alwaysensure the filling is deeper than the potato. 7.Stirring Stir any sauce- based foods before heating,particularly if they have been defrosted. Thisensures any icy particles or cold areas are fullybroken up and the food is of an even temperature. 8.Browning/Finishing Dishes If you are preparing dishes in bulk for freezing orrefrigeration, don’t forget that because yourPanasonic Combi is a microwave andconventional oven, you can choose to brownfoods at the end of preparation but before storing,or store unbrowned and reheat on CONVECTION.9.Heating two dishes together  If you wish to reheat more than one dish, placethem side by side on the base of the cavity andNEVER use the Wire Rack Shelf for reheating on 2 levels. 10.Heating Times It is impossible to give the heating time of anindividual plated meal as each will contain adifferent variety of foods in differing quantities.Follow the arranging tips already mentioned andensure the thickest piece of food has reached 72°C. Reheating by MicrowaveMicrowave",43,545
Suggested Reheating Times,Suggested Reheating Times Multi Portion Entrées FOOD WEIGHT START TEMPAPPROX. TIME HIGH POWER Hungarian Goulash Hickory Chicken Chicken Tikka Masala Lamb Rogan Josh Chilli Con Carne Pork or Chicken Sweet and Sour Spicy Sausage Casserole Chicken Casserole Irish Stew Stew with Dumplings Vienna Steaks  with GravyLiver and Bacon Chicken or Beef Curry Mushroom Stroganoff Vegetable/Quorn® Tikka masala/CurryVegetable Chilli1.36kg 3lb 1.36kg 3lb 1.36kg 3lb 1.36kg 3lb 1.47kg 3lb 4oz 1.36kg 3lb 1.76kg 3lb 14oz 1.36kg 3lb 1.36kg 3lb 1.81kg 4lb 1.42kg 3lb 2oz 1.36kg 3lb 1.36kg 3lb 1.36kg 3lb 1.36kg 3lb 1.42kg 3lb 2oz2°C -18°C 2°C -18°C 2°C -18°C 2°C -18°C 2°C -18°C 2°C -18°C 2°C -18°C 2°C -18°C 2°C -18°C 2°C -18°C 2°C -18°C 2°C -18°C 2°C -18°C 2°C -18°C 2°C -18°C 2°C -18°C9 - 10 mins 18 - 19 mins 91/2- 101/2mins 19 - 20 mins 91/2- 101/2mins 19 - 20 mins 8 - 9 mins 17 - 18 mins 81/2- 91/2mins 17 - 18 mins 81/2- 91/2mins 17 - 18 mins 11 - 12 mins 23 - 25 mins 8 - 9 mins 16 - 17 mins 9 - 10 mins 17 - 18 mins 101/2- 111/2mins 19 - 20 mins 11 - 12 mins 20 - 21 mins 8 - 9 mins 17 - 18 mins 81/2- 91/2mins 16 - 17 mins 7 - 8 mins 15 - 16 mins 8 - 9 mins 16 - 17 mins 8 - 9 mins 161/2- 171/2mins NOTES: Heating times will vary with the quantity of food: more food requires a longer heating time. Adjust the heating time as follows:±100g (4oz) will usually be covered by the suggested time band ±225g (8oz) add or deduct 30secs ±450g (1lb) add or deduct 1 min.Microwave,45,629
Chilli con Carne,"Chilli con Carne Chicken Curry with Rice Irish Stew Vegetable Curry Vegetable Mexicana Spaghetti Bolognaise Lasagne Smoked Haddock Pasta  with Prawns & Mushrooms Tuna Pasta Bake Tagliatelle Carbonara Cottage Pie Moussaka NOTES: REMEMBER: Wherever possible 1.Stir foods before, halfway through and at the end of a heating time.2.Cover food.3.Ensure the thickest piece of food or centre reaches 72°C.Individual Entrées FOOD WEIGHT START TEMPAPPROX. TIME HIGH POWER 300g 11oz 300g 11oz 300g 11oz 300g 11oz 290g 101/2oz 300g 11oz 300g 11oz 290g 101/2oz 2o 300g 11oz 300g 11oz 340g 113/4oz 295g 103/4oz2°C -18°C 2°C -18°C 2°C -18°C 2°C -18°C 2°C -18°C 2°C -18°C 2°C -18°C 2°C -18°C 2°C -18°C 2°C -18°C 2°C -18°C 2°C -18°C31/2- 4 mins 6-  61/2mins 6 - 61/2mins 31/2- 4 mins 51/2- 6 mins 51/2- 6 mins 31/2- 4 mins 51/2- 6 mins 6 - 61/2mins 2 - 21/2mins 4 - 41/2mins 41/2- 5 mins 4 - 41/2mins 6 - 61/2mins DEFROST FIRST 31/2- 4 mins 51/2- 6 mins 6 - 61/2mins 31/2- 4 mins 51/2- 6 mins DEFROST FIRST 4 - 41/2mins 6 - 61/2mins 6 - 61/2mins 3 - 31/2mins 41/2- 5 mins DEFROST FIRST 4 - 41/2mins 6 - 61/2mins 51/2- 6 mins 31/2- 4 mins 51/2- 6 mins DEFROST FIRST 4 - 41/2mins 6 - 61/2mins DEFROST FIRSTQUANTITY 1 2 1 1 2 1 1 2 1 1 2 1 1 2 — 1 2 1 1 2 — 1 2 1 1 2 — 1 2 1 1 2 — 1 2 —Suggested Reheating TimesMicrowave",47,612
Mushroom & Nut Fettucine,"Mushroom & Nut Fettucine Macaroni Cheese Cauliflower Cheese Vegetable Chilli Vegetable Strogonoff Lentil Crumble  Pie Fillings NOTES: REMEMBER: Wherever possible 1.Stir foods before, halfway through and at the end of a heating time.2.Cover food.3.Ensure the thickest piece of food or centre reaches 72°C.Individual Entrées FOOD WEIGHT START TEMPAPPROX. TIME HIGH POWER 280g 101/4oz 300g 11oz 300g 11oz 290g 101/2oz 290g 101/2oz 300g 11oz 250g 9oz2°C -18°C 2°C -18°C 2°C -18°C 2°C -18°C 2°C -18°C 2°C -18°C 2°C -18°C31/2- 4 mins 51/2 - 6 mins 51/2- 6 mins 31/2 - 4 mins 51/2 - 6 mins DEFROST FIRST 4 - 41/2mins 6 - 61/2mins DEFROST FIRST 23/4- 3 mins 4 - 41/2mins 6 - 61/2mins 31/2- 4 mins 5 - 51/2mins 6 - 61/2mins 3 - 31/2mins 41/2- 5 mins DEFROST FIRST 31/2- 4 mins 5 - 51/2mins 51/2- 6 minsQUANTITY 1 2 1 1 2 — 1 2 — 1 2 1 1 2 1 1 2 — 1 21Suggested Reheating Times",48,382
Cooked Bacon Slices,"Cooked Bacon Slices Barbecue Half Rack Ribs Chicken Tikka Wings of Fire Cooked Chicken Drumsticks Cooked half Chicken Cooked Quarter Chicken Cooked Supréme of Chicken Cooked Breast of Chicken Cooked Diced Chicken Meat Cooked Chicken/Pork Sate Omelettes Baked Yorkshire Pudding Peanut sauce Pizza Quiche Slices Baked Sausage Rolls Baked Pies/Pasties Naan Bread Burger buns & rolls Rice Portions Salad Mixes Rice Salad Mixes Baked Beans NOTES: REMEMBER: Wherever possible 1.Stir foods before, halfway through and at the end of a heating time.2.Cover food.3.Ensure the thickest piece of food or centre reaches 72°C.Snack/Bar Foods FOOD WEIGHT START TEMPAPPROX. TIME HIGH POWER 8g / 1/4oz 200-250g / 7-9oz 175g / 6oz 100g / 4oz 50-75g / 2-3oz 275g / 10oz 150-200g / 5-7oz 160g / 51/4oz 250-300g / 9-11oz 450g / 1lb 35g / 11/2oz 100g / 4oz 80g / 31/2oz  10oz / 275g 180mm / 7inch 100g / 4oz 150g / 5oz 175g / 6oz 150g / 5oz 50g / 2oz 175g / 6oz 100g / 4oz 100g / 4oz 175g / 6oz -18°C -18°C -18°C -18°C -18°C -18°C -18°C -18°C -18°C -18°C -18°C -18°C -18°C -18°C -18°C -18°C -18°C -18°C -18°C -18°C -18°C -18°C -18°C Ambient21/2mins 31/2 - 41/2mins 2-  21/2mins 11/2mins 1 min 45 secs - 2 mins 61/2 - 7mins  31/2 - 4 mins 31/2mins 7 - 71/2 mins 41/2 mins 1 min 2 mins 20 secs 50 secs 5 mins 2 mins 45 secs 1min 50 secs 3 mins 1 min 20 secs 1 min 50 secs 1 min 50 secs 1 min 40 secs 1 min 20 secsQUANTITY 20 1 1 1 1 1 1 3 1 1 1 1 1 1 1 1 1 1bagSuggested Reheating Times Filled Pasta in Sauce Duckling à la OrangeChicken Breast with  Leek and Stilton Vension in red WineSalmon in Asparagas SauceÀ La Carte FOOD WEIGHT START TEMPAPPROX. TIME HIGH POWER 280g / 101/4oz 275g / 10oz 250g / 9oz 290g / 101/2oz 200g / 7oz-18°C -18°C-18°C -18°C-18°C6 mins *6 - 61/2mins *7 - 71/2mins 5 mins *5 - 6 minsQUANTITY 1 11 11 *USE MEDIUM POWERMicrowave",49,749
Baked Jacket Potatoes,"Baked Jacket Potatoes Baked Potato Shells Beans Brussel Sprouts Cauliflower Florets Broccoli Baby Carrots Courgettes New Potatoes Vegetable Selections Potato Mash NOTES: REMEMBER: Wherever possible 1.Stir foods before, halfway through and at the end of a heating time.2.Cover food.3.Ensure the thickest piece of food or centre reaches 72°C.Cooked Vegetables FOOD WEIGHT START TEMPAPPROX. TIME HIGH POWER 250g / 9oz 75g / 3oz 100g / 4oz 100g / 4oz 100g / 4oz 100g / 4oz 100g / 4oz 100g / 4oz 175g / 6oz 100g / 4oz 175g / 6oz2°C -18°C -18°C 2°C 2°C 2°C 2°C 2°C 2°C 2°C 2°C -18°C2 mins 4 mins 1 min 30secs 1 min 1 min  1 min 50 secs 1 min 1 min 1 min 50 secs 50 secs 3 minsQUANTITY 1 1 2Suggested Reheating Times CrepesScones Teacakes Doughnuts Mini Patisserie Danish PastriesPre-cut Fruit Flans Microwave Puddings Traditional PuddingCustard SticksSweets/Puddings FOOD WEIGHT START TEMPAPPROX. TIME HIGH POWER 20g / 3/4oz 55g / 21/4oz 75g / 3oz 50g / 2oz 12g / 1/2oz 75g / 3oz 100g / 4oz 175g / 6oz 100g / 4oz 50g / 2oz2°C 2°C -18°C -18°C 2°C -18°C -18°C 2°C -18°C -18°C -18°C-18°C30 secs 15 secs 20 secs 20 secs 10 secs 15 secs 25 secs 40 secs 1 min 1 min 30 secs 45 secs 1 minQUANTITY 2 1 1 1 1 1 1 1 slice 1 slice 1 1 slice 3",50,495
Defrosting by Microwave,"Defrosting by Microwave Follow these tips for best results: 1.Meat Place meats on a rack, trivet or upturned saucer ina shallow dish. This enables the water to drainfrom the food and defrost correctly; if the food sitsin the liquid it is likely to begin to cook and apoached effect is created. 2.Foods in Foil Transfer foods packaged in aluminium foilcontainers into suitable microwaveable dishesbefore defrosting. 3.Arranging Arrange the food evenly and in a shallow layer onthe rack or plate. Do not pile foods up as this willprevent the food at the bottom from defrosting inthe same time as the food on the top. 4.Uneven Shapes Always arrange thick areas of the food to theoutside of the dish, and thinner areas to thecentre. this is particularly important for chops andchicken portions. Where possible, arrange twouneven shaped pieces of food in a dish with thethick area of one piece to the thin area of theother, to ensure even defrosting. 5.Shielding Check food to ensure it does not over-defrost.Remove any defrosted food, if possible, and turnand shield thinner areas of food. It will benecessary to shield the breast, ends of the legsand wings on a chicken, and the head and tail of awhole fish. Separate items such as chops,sausages and steaks and rearrange in a singlelayer as soon as possible. To shield, coverdefrosted, and thinner, or fatty areas of food, withsmall pieces of aluminium foil. This will reflect themicrowave energy away from that area to preventit from over defrosting and beginning to cook.Check foods at least twice duringthe defrosting time and shield, as necessary,ensuring the foil is still securely in place.N.B. Ensure the foil does not touch the side or roofof the cavity or “arcing” my occur. If this doeshappen, stop the microwave and rearrange thefoods. 6.Cooling For best results DEFROST foods in a cool oven.(See page 35.) 7.Standing Time Food should still feel icy at the end of thedefrosting time; this will disappear during thestanding time. Do NOT be tempted to put foodback to continue to defrost in the microwave asthis will lead to over defrosting. Allow small itemsof food to stand for 15 minutes before cooking;larger pieces of food will need longer. Cover foodsduring the standing time, to prevent contaminationby airborne bacteria. 8.Container Shape Foods in square shaped containers need carefulattention during defrosting to prevent corners frombeginning  to cook. It may be necessary to stoplarger portions of food during the defrosting time toshield the corners with aluminium foil. Afterdefrosting, always remember to transfer the foodinto more suitable, round containers beforereheating in the microwave. 9.Stirring Foods that can be stirred, such as curries,casseroles and meat sauces, should, as thedefrosting time progresses, be broken up andstirred. Stir the food before, and after, the standingtime as this helps to break up the ice particles andspeed up defrosting.  10.Solid foods Foods that can not be stirred, eg lasagne, CottagePie and pastry-topped dishes, benefit fromstanding for a period of time in the middle ofdefrosting. This enables the product to defrostthrough to the centre without the edges becomingexcessively hot, use the Multi-stage programmefacility. See page 17. 11.Foods not listed in Defrost Charts To defrost food not mentioned in the charts, selectthe Defrost power setting and as a rough GUIDE,allow 20-30 seconds per 1oz/25g of food. Whenusing this method do not leave the foodunattended as it defrosts, but check frequently. NOTE: Calculate the defrosting time accurately and followany specific instructions.  The ability to defrost foods quickly is another excellent benefit of your Panasonic Combi.The quality of the defrosted food will depend a great deal on the care the food receives in freezing and defrosting, so alwaysensure that the best food is frozen and that it is packaged correctly.Ensure the freezer is running at the correct temperature(-18°C or below) and that it is not overloaded with foodor ice. Always label and date foods so that they can be used in strict rotation.Always defrost using the Defrost power setting. NEVER try hurry the defrosting by selecting a higher powerlevel as this will only over-defrost the food, causing it to become tough and inedible leading to waste.Microwave",51,984
Stir halfway through,"Stir halfway through defrosting time Rearrange halfway through defrosting time Shield head and tail after half   time Place on rack. After half time stand for 15 mins, shield and continue. As Lamb joints As Lamb joints Turn and separate Break up and remove any defrosted meat halfway through  time Place on rack. After half time,  shield, turn and remove giblets. Place on rack and arrange  correctly Place on rack, after half time.  Stand for 15 mins, shield and  continue. As Chicken Portions. Separate rashers during defrosting time As Gammon Remove any  defrosted rashers  NOTES: Check food regularly during defrosting to ensure over-defrosting does not occur.Useful Defrosting Times Prawns Fish fillets Whole fish Lamb Joints Pork Joints Beef Joints Steaks Minced/CubedMeats Chicken Chicken Portions Turkey Chops Gammon BaconFOOD WEIGHT INSTRUCTIONS STAND TIME 450g 1lb 2oz 450g 1lb 2oz 350g 12oz 450g 1lb 2oz 450g 1lb 2oz 450g 1lb 2oz 450g 1lb 2oz 450g 1lb 2oz 450g 1lb 2oz 450g 1lb 2oz 450g 1lb 2oz 450g 1lb 2oz 450g 1lb 2oz 450g 1lb 2oz5 mins. Wash under  cold water 10 mins. Wash under  cold water10 mins. Wash under  cold water45 - 60 mins 45 - 60 mins 45 - 60 mins 10 mins 10 mins 30 mins. Wash well 10 mins 45 -60 mins 10 mins 10 mins 10 minsAPPROX. TIME PER 450g/1lb 2oz 6 mins 8 mins 10 mins 12 mins 9 mins 9 mins 10 mins 6 - 8 mins 13 mins 9 mins 12 mins 5 mins 8 mins 9 mins",52,452
Separate and rearrange after,"Separate and rearrange after half time. Place in suitable dish. Stir well halfway through. Place in suitable dish,  Shield corners as necessary. Place in suitable dish,  Stir well halfway through. Place in suitable dish,  Stand for 5 mins during  defrosting. Remove all packaging and place on plate. Place in shallow dish. Stir carefully after half time. Leave in foil container Remove all packaging and place on plate. Remove all packaging and place on plate. Remove all packaging and place on plate. Remove all packaging and place on plate. NOTES: Check food regularly during defrosting to ensure over defrosting does not occur.Useful Defrosting Time Sausages Multi portion Entrées-StirrableMulti portionEntrées- Non-StirrableIndividualEntrées- StirrableIndividualEntrées- Non-StirrableChocolate Mousse GateauFruit Baked Fruit Passion Cake (Pre-Cut)Black Forest GateauBanoffi Pie (Pre-Cut)ToffeeApple & Pecan PieFOOD WEIGHT INSTRUCTIONS STAND TIME 450g/ 1lb 2oz 1.36kg/3lb 1.36kg/3lb 300g/11oz 300g/11oz 20cm/8"" 450g/1lb 2oz 1.22kg/ 2lb 11oz 24cm/9"" 24cm/9"" 26cm/10"" 26cm/10""10 mins 20-30 mins  Stir well 20-30 mins  5-10 mins Stir well 5-10 mins 10 mins 10 mins 15 mins 10 mins 10 mins 10 mins 10-20 minsAPPROX. TIME PER 450g/1lb 2oz 6 mins 20 mins 30 mins 8 mins 12 mins 3 mins 6 mins 9 mins 5 mins 4 mins 6 mins 11 minsMicrowave",53,413
.Arranging,".Arranging When cooking fillets or whole fish, always arrangethe thicker part to the outside of the container and,wherever possible, make even-shaped parcels offish. Cook two whole fish together, placed head totail with backbone towards the outside of the dish. 2.Shielding Single whole fish will need to have the head andtail ends shielded with aluminium foil halfwaythrough the cooking time. (See page 49)Cooking by Microwave Fish 3.Whole fish  Score the sides of whole fish prior to cooking; thisprevents the skin from bursting and splattering theoven cavity. A better result is obtained if whole fishare cooked on a LOWER power setting rather thanHIGH power. 4.Fish fillets Fish fillets should be rolled so that the head andtail of the fillet overlap forming a fish parcel. Anynumber of fillets can be cooked together, on HIGHpower, in this way. Arranging food in this mannermeans that it cooks evenly and without the need toshield with aluminium foil. VegetablesCommercial ovens are primarily used for reheating and defrosting. It is possible however to cook certain foodseg. fish and vegetables very successfully by microwave. These foods should be limited to small quantities aslarger amounts will not offer any time saving. 1.Adding salt Vegetables cooked by microwave, retain theircolour and texture. The short cooking times andsmall quantity of cooking liquid required ensuresthe vegetables do not lose their nutritive value. Do not add salt to the vegetables. 2.Cooking vegetables together  It is possible to cook a selection of vegetablestogether in the same dish if they have roughly thesame cooking time per pound. Do not, forexample, cook new potatoes alongside frozenpeas, as the peas will be cooked and the potatoesalmost raw. 3.Adding water A small amount of water is required to generatesufficient steam to begin to cook the vegetables;the microwave energy will then complete thecooking within the vegetables themselves. If toomuch liquid is added this will increase the cookingtime considerably.4.Container size Choose the size of the dish to match the quantityof vegetables to be cooked. A large, covered bowlwith only a handful of food in the base does notcook very well. 5.Arranging Always arrange the denser parts of the vegetablesto the outside of the dish. With vegetables such asbroccoli the denser part is the stalk. 6.Part-cooking If the vegetables are going to be pre-cooked forplating up, refrigerating and regenerating at a laterdate, reduce the cooking time by about a third;during the reheating time the vegetables willcomplete their cooking, retaining their “bite”.  7.Standing time It is important to allow vegetables to stand beforetesting to see if they are correctly cooked. Thisprevents the vegetables over cooking andbecoming tough.",54,591
FOOD INSTRUCTIONS STAND TIME,"FOOD INSTRUCTIONS STAND TIME Beans Broccoli Cabbage Carrots Cauliflower Courgettes Potatoes  Vegetable Selection Trim ends. Slice thinly. Add 4tbsp/60ml water. Cover. Trim stems, cut cross in base. Arrange stem to outside.  Add  4tbsp/60ml water. Cover.Shread, remove thick parts ofstem. Add 12tbsp/180ml water. Cover.Slice evenly.  Add 4tbsp/60ml water. Cover.Divide into florets.  Add 4tbsp/60ml water. Cover.Slice evenly.  Add 2tbsp/30ml  water. Cover.Cut evenly.  Add 4tbsp/60ml water. Cover.Cut evenly. Add 4tbsp/60ml water. Cover.5 mins 5 mins 5 mins 5 mins 5 mins 5 mins 5 mins 5 minsAPPROX. TIME HIGH POWER 5 - 51/2mins 5 - 51/2mins 7 mins 4 - 41/2mins 7 mins 4 - 41/2mins 7 - 71/2mins 6 minsFresh Vegetables (Per 450 g/ 1lb 2oz) FOOD INSTRUCTIONS STAND TIME Beans Broccoli Brussel Sprouts Cauliflower Baby Carrots Courgettes  Corn Vegetable Selection  PeasAdd 2tbsp/30ml water, cover. Add 4tbsp/60ml water, cover. Add 4tbsp/60ml water, cover. Add 4tbsp/60ml water, cover. Add 2tbsp/30ml water, cover. No water.Cover. Add 2tbsp/30ml water, cover. Add 2tbsp/30ml water, cover.Add 2tbsp/30ml water, cover.5 mins 5 mins 5 mins 5 mins 5 mins 5 mins 5 mins 5 mins5 minsAPPROX. TIME HIGH POWER 7 mins 6 mins 7 mins 7 mins 7 mins 51/2mins 51/2mins 51/2mins 51/2minsFrozen Vegetables (Per 450 g/ 1lb 2oz)Useful Cooking TimesMicrowave FOOD INSTRUCTIONS STAND TIME Whole fish Fish fillets/steaksShield as required during cooking time. Cover. Arrange correctly. Cover.5 mins 5 minsAPPROX. TIME HIGH POWER 5 mins 4 minsFrozen Fish (Per 450 g/ 1lb 2oz)",55,543
Using the Convection Function,"Using the Convection Function The fan forces hot air over the food thus heating food very efficiently. To avoid over-cooking and drying of the surface it is recommended that normal cooking temperatures are reduced by 10-20°C. Cooking times byconvection are also usually shorter compared to conventional ovens.Reducing cooking temperature Do not attempt to use the Wire Rack Shelf to cook on two levels.Two level cooking Convection ovens rely on good circulation of air. For best results ensure food/containers are placed in thecentre of the Wire Rack Shelf and avoid the container touching back wall or covering venting holes.To allow good circulation of hot air, the maximum sized dish used should be no greater than Width:      12ins (30cms)Depth:      4ins (10cms)Diameter: 11ins (28cms)Positioning food For best results, always place food into a preheated oven. See page 34.Preheating Take care when removing dishes from the oven after cooking as the Wire Rack and surfaces will be hot.Hot surfaces All foods should be placed on the Lower Shelf PositionConvection is suitable to bake cakes, bread, biscuits or pastries.Suitable FoodsDO USE: Any container suitable for conventional ovens eg metal, ceramic, earthenware, enamelled cast iron etc. DO NOT USE: Plastic containers, food films, wood/wicker, glass, paper.Type of Container to use",56,289
